github,haiku,latitude,longitude
machikoyasuda,"Oh, Little Tokyo<br />Temples, sushi and the mall<br />Now with GA too!",34.0523,-118.239
anatanson,"A cool place I like<br />It's a good place to hangout.<br />Must try the mezcal",34.052403,-118.300699
machikoyasuda,"Bonaventure bar<br />Revolves around and around<br />Will it make me sick?<br /><img src='http://l7.alamy.com/zooms/c278528458484e1cb0ed8e936a25b22b/westin-bonaventure-hotel-ay24tn.jpg' width='100'>",34.052571, -118.256008
kzinser,"i like lots of cats, <br/>they are small, cute, fun, and fast<br/>and they like treats too.",34.083586,-118.362380
mikejun,"All fans gather here<br /> Dodgers, expensive hotdogs<br />And they lose again!",34.0547832, -118.2382913
mattymcgraw,"No one likes the valley,<br />Suburbs, traffic and the heat<br />Better have a pool!",34.210747, -118.579015
sandext,"Waiting for the first snowfall in Big Bear </br><img src='http://www.visitcalifornia.com/sites/default/files/styles/welcome_image/public/VC_BigBearLakeWinter_Hero_BigBearMtn_Supplied_H4Y4191_1280x640_0.jpg' width=200>", 34.2439, -116.9114
